{
  "document_id": "legacy/story/750623f119b8/ch04",
  "extensions": {
    "legacy": {
      "chapter": 4,
      "location": "希莉亞帶隊抄近路前往賽拉村,途中遭盜賊「豹」的黨羽伏擊。路過的巴拿羅西亞、聖寇拉斯等龍人見獵心喜想去湊熱鬧,卻被同伴「惡」嚇阻而作罷。",
      "source_dat": "FDTXT_004",
      "title": "第四章 — 近路遇襲,龍人看熱鬧"
    }
  },
  "kind": "story",
  "scenes": [
    {
      "beats": [],
      "extensions": {
        "legacy": {
          "label": null
        }
      },
      "lines": [
        {
          "extensions": {
            "legacy": {
              "speaker": 8,
              "speaker_name": "希莉亞"
            }
          },
          "line_id": "legacy/line/750623f119b8/scenes/0/lines/0",
          "speaker": "character/native-8",
          "text": "快到賽拉村啦!抄這條近路很快就到了。怎樣?還是帶著我比較好吧?"
        },
        {
          "extensions": {
            "legacy": {
              "speaker": 0,
              "speaker_name": "索爾"
            }
          },
          "line_id": "legacy/line/750623f119b8/scenes/0/lines/1",
          "speaker": "character/native-0",
          "text": "老是走這種小道,搞不好會碰上強盜喔!"
        },
        {
          "extensions": {
            "legacy": {
              "speaker": 8,
              "speaker_name": "希莉亞"
            }
          },
          "line_id": "legacy/line/750623f119b8/scenes/0/lines/2",
          "speaker": "character/native-8",
          "text": "誰說的,這條路隱密的很,只有我才知道.."
        },
        {
          "extensions": {
            "legacy": {
              "speaker": 1,
              "speaker_name": "哈諾"
            }
          },
          "line_id": "legacy/line/750623f119b8/scenes/0/lines/3",
          "speaker": "character/native-1",
          "text": "看,前面好像有人呢!"
        }
      ],
      "scene_id": "legacy/scene/750623f119b8/scenes/0"
    },
    {
      "beats": [],
      "extensions": {
        "legacy": {
          "label": "小路遇襲"
        }
      },
      "lines": [
        {
          "extensions": {
            "legacy": {
              "speaker": -1,
              "speaker_name": "豹"
            }
          },
          "line_id": "legacy/line/750623f119b8/scenes/1/lines/0",
          "speaker": "legacy/speaker/750623f119b8/scenes/1/lines/0",
          "text": "你們想到賽拉村嗎?你們是來幹什麼的?"
        },
        {
          "extensions": {
            "legacy": {
              "speaker": 0,
              "speaker_name": "索爾"
            }
          },
          "line_id": "legacy/line/750623f119b8/scenes/1/lines/1",
          "speaker": "character/native-0",
          "text": "干你屁事!不要礙路!"
        },
        {
          "extensions": {
            "legacy": {
              "speaker": -1,
              "speaker_name": "豹"
            }
          },
          "line_id": "legacy/line/750623f119b8/scenes/1/lines/2",
          "speaker": "legacy/speaker/750623f119b8/scenes/1/lines/2",
          "text": "首領說得沒錯,果然有人抄小路來偷襲了!"
        },
        {
          "extensions": {
            "legacy": {
              "speaker": 4,
              "speaker_name": "亞雷斯"
            }
          },
          "line_id": "legacy/line/750623f119b8/scenes/1/lines/3",
          "speaker": "character/native-4",
          "text": "什麼偷襲?把話講清楚!"
        },
        {
          "extensions": {
            "legacy": {
              "speaker": -1,
              "speaker_name": "豹"
            }
          },
          "line_id": "legacy/line/750623f119b8/scenes/1/lines/4",
          "speaker": "legacy/speaker/750623f119b8/scenes/1/lines/4",
          "text": "少裝了!死吧!"
        }
      ],
      "scene_id": "legacy/scene/750623f119b8/scenes/1"
    },
    {
      "beats": [],
      "extensions": {
        "legacy": {
          "label": "龍人看熱鬧"
        }
      },
      "lines": [
        {
          "extensions": {
            "legacy": {
              "speaker": 24,
              "speaker_name": "希爾法"
            }
          },
          "line_id": "legacy/line/750623f119b8/scenes/2/lines/0",
          "speaker": "character/native-24",
          "text": "嗷嗚!..是誰在這裡大吵大鬧?"
        },
        {
          "extensions": {
            "legacy": {
              "speaker": 25,
              "speaker_name": "謝多"
            }
          },
          "line_id": "legacy/line/750623f119b8/scenes/2/lines/1",
          "speaker": "character/native-25",
          "text": "吼..好像是人類在打架。"
        },
        {
          "extensions": {
            "legacy": {
              "speaker": 26,
              "speaker_name": "聖寇拉斯"
            }
          },
          "line_id": "legacy/line/750623f119b8/scenes/2/lines/2",
          "speaker": "character/native-26",
          "text": "呼..好像很有趣,我們去打人少的那一邊!"
        },
        {
          "extensions": {
            "legacy": {
              "speaker": 27,
              "speaker_name": "巴拿羅西亞"
            }
          },
          "line_id": "legacy/line/750623f119b8/scenes/2/lines/3",
          "speaker": "character/native-27",
          "text": "贊成!贊成!"
        },
        {
          "extensions": {
            "legacy": {
              "speaker": -1,
              "speaker_name": "惡"
            }
          },
          "line_id": "legacy/line/750623f119b8/scenes/2/lines/4",
          "speaker": "legacy/speaker/750623f119b8/scenes/2/lines/4",
          "text": "好可怕!不玩了!不玩了!"
        }
      ],
      "scene_id": "legacy/scene/750623f119b8/scenes/2"
    },
    {
      "beats": [],
      "extensions": {
        "legacy": {
          "label": null
        }
      },
      "lines": [
        {
          "extensions": {
            "legacy": {
              "speaker": 0,
              "speaker_name": "索爾"
            }
          },
          "line_id": "legacy/line/750623f119b8/scenes/3/lines/0",
          "speaker": "character/native-0",
          "text": "奇怪了,在這大陸上到處都遇得上強盜!"
        },
        {
          "extensions": {
            "legacy": {
              "speaker": 8,
              "speaker_name": "希莉亞"
            }
          },
          "line_id": "legacy/line/750623f119b8/scenes/3/lines/1",
          "speaker": "character/native-8",
          "text": "不對,賽拉村可能出事了!我們趕快趕過去看看!"
        },
        {
          "extensions": {
            "legacy": {
              "speaker": 1,
              "speaker_name": "哈諾"
            }
          },
          "line_id": "legacy/line/750623f119b8/scenes/3/lines/2",
          "speaker": "character/native-1",
          "text": "打了一場大戰,不休息一下嗎?"
        },
        {
          "extensions": {
            "legacy": {
              "speaker": 8,
              "speaker_name": "希莉亞"
            }
          },
          "line_id": "legacy/line/750623f119b8/scenes/3/lines/3",
          "speaker": "character/native-8",
          "text": "放心,途中有個小村落可以稍事休息。走吧!"
        }
      ],
      "scene_id": "legacy/scene/750623f119b8/scenes/3"
    },
    {
      "beats": [],
      "extensions": {
        "legacy": {
          "label": "其他短句"
        }
      },
      "lines": [
        {
          "extensions": {
            "legacy": {
              "speaker": 0,
              "speaker_name": "索爾"
            }
          },
          "line_id": "legacy/line/750623f119b8/scenes/4/lines/0",
          "speaker": "character/native-0",
          "text": "這..這是什麼碗糕!"
        },
        {
          "extensions": {
            "legacy": {
              "speaker": -1,
              "speaker_name": "豹"
            }
          },
          "line_id": "legacy/line/750623f119b8/scenes/4/lines/1",
          "speaker": "legacy/speaker/750623f119b8/scenes/4/lines/1",
          "text": "哇.啊..!"
        }
      ],
      "scene_id": "legacy/scene/750623f119b8/scenes/4"
    }
  ],
  "schema_version": 1,
  "source": {
    "importer_version": "fd2-editor-legacy-importer/1.0",
    "path": "remake/assets/story/ch04.json"
  }
}
